{
  "$schema": "https://raw.githubusercontent.com/JakubekWeg/wonder/master/barbet/enum-schema.json",
  "name": "ModelId",
  "output-file": "model-id",
  "add-size": true,
  "values": {
    "Slime": {
      "@build": {
        "from": "./entity/slime",
        "property": "buildPoses"
      }
    }
  },
  "getters": {
    "getBuildPosesCallback": {
      "field": "@build"
    }
  }
}
